Kanji	Significado	Leitura(s) ON	Leitura(s) KUN	Mnemônica	Nível JLPT
翻	Virar, traduzir	ホン, ハン	ひるがえ・る, ひるがえ・す	Como as sensíveis asas (羽) na sua rápida e decisiva vez (番) de atuar num voo, ele decide repentinamente virar as intenções e traduzir.	N1
羊	Ovelha	ヨウ	ひつじ	A forma dos próprios chifres, face comprida e o rabo felpudo criam de facto o desenho que exibe e denota a mansa ovelha.	N1
枕	Travesseiro	チン, シン	まくら	A rústica placa cortada de madeira (木) onde o andante ou qualquer pessoa hesitante (冘) descansa finalmente a cabeça é o seu travesseiro.	N1
錯	Confusão, erro	サク	Não possui	Encontrar acidentalmente um metal (金) muito precioso mas infelizmente perdido num passado bem distante (昔) gera na contabilidade grande confusão e erro.	N1
謙	Modesto, humilde	ケン	Não possui	Palavras (言) proferidas sem tentar acumular ou possuir tudo ao mesmo tempo (兼) definem alguém modesto e humilde.	N1
珠	Pérola, joia	シュ, ジュ, ス	Não possui	O rei (王) encontrou uma pequena pedra de um vermelho forte (朱) e percebeu tratar-se de uma rara pérola e joia.	N1
蓄	Acumular, armazenar	チク	たくわ・える	Proteger a grama e o mato verde (艹) para alimentar o gado (畜) no inverno é a melhor forma de acumular e armazenar.	N1
拓	Desbravar, abrir (terra)	タク, セキ	Não possui	Usar a sua própria mão (扌) para remover cada pesada pedra (石) do terreno é o primeiro passo para desbravar e abrir a terra.	N1
鼓	Tambor, bater	コ, ク	つづみ	O guerreiro (士) que apoia (支) um instrumento parecido a um enorme grão (豆) prepara-se para tocar no seu tambor e bater.	N1
粋	Elegante, puro, essência	スイ, サイ	いき	O valioso grão de arroz (米) escolhido entre noventa (九, 十) opções é certamente o mais elegante e puro, revelando a sua essência.	N1
尉	Oficial militar	イ	Não possui	A postura do corpo (尸) que exibe (示) uma disciplina precisa na sua medida (寸) pertence a um honrado oficial militar.	N1
后	Imperatriz	コウ	Não possui	Um severo traço (ノ, 一) e regra que sai diretamente da boca (口) de quem governa o palácio é imposto pela imperatriz.	N1
粘	Pegajoso, viscoso	ネン, デン	ねば・る	O arroz cozido (米) que consegue grudar e ocupar (占) tudo ao redor acaba por ser extremamente pegajoso e viscoso.	N1
披	Expor, revelar	ヒ	Não possui	Ao usar a mão (扌) para puxar e tirar a cobertura externa de pele (皮), consegue-se finalmente expor e revelar o segredo.	N1
徐	Gradualmente, lentamente	ジョ	Não possui	O passo (彳) de quem ainda possui tempo e energia de sobra (余) avança, sem qualquer pressa, gradualmente e lentamente.	N1
悦	Alegria, deleite	エツ	Não possui	O aliviado coração (忄) do irmão mais velho (兄) a sorrir com o olhar feliz (丷) demonstra uma profunda alegria e deleite.	N1
堪	Suportar, aguentar	カン	た・える	A densa parede de terra (土) que enfrenta um evento extremamente severo (甚) mostra ser capaz de suportar e aguentar o impacto.	N1
冠	Coroa, melhor	カン	かんむり	Sobre a cobertura da cabeça (冖), usar desde a origem (元) a exata medida (寸) de ouro serve para fabricar a melhor coroa.	N1
愉	Agradável, alegre	ユ	Não possui	O coração (忄) de quem se reúne (亼) à luz do luar (月) num ambiente protegido por armas (刂) num refúgio seguro é agradável e alegre.	N1
尿	Urina	ニョウ	Não possui	A água (水) e os fluidos inúteis que são naturalmente escoados e expulsos para fora do corpo (尸) constituem a urina.	N1
顎	Queixo, mandíbula	ガク	あご	Falar com grande espanto (咢) move intensamente a parte inferior da face e cabeça (頁), conhecida por queixo e mandíbula.	N1
誓	Juramento, promessa	セイ	ちか・う	Tentar dobrar e quebrar (折) as próprias palavras dadas (言) não é uma atitude aceitável para cumprir um bom juramento e promessa.	N1
憂	Melancolia, ansiedade	ユウ	うれ・える, うれ・い, う・い	A cabeça (頁) pesada sob o pano (冖) de quem tem o coração (心) a rastejar (夂) pelo cansaço do tempo sofre de melancolia e ansiedade.	N1
簿	Livro de registro	ボ, ホ	Não possui	Tábuas de bambu (竹) lavadas por água (氵) e destinadas a uso exclusivo (専) de escrita (丶) formam um essencial livro de registro.	N1
糧	Provisões, mantimentos	リョウ, ロウ	かて	A saca de arroz cru (米) perfeitamente medida na sua exata quantidade (量) é fundamental para levar como provisões e mantimentos.	N1
架	Suporte, armação	カ	か・ける, か・かる	O ato de adicionar progressivamente (加) estacas rijas de madeira (木) ergue de modo seguro um firme suporte e armação.	N1
芽	Broto, botão	ガ	め	A tenra relva (艹) que começa a rasgar o solo afiada como a ponta de uma presa (牙) é ainda apenas um frágil broto e botão.	N1
軸	Eixo	ジク	Não possui	Ao examinar a velha carruagem (車), vemos que a grande razão ou origem (由) do seu giro firme é inquestionavelmente o eixo.	N1
苛	Tormento, irritação	カ	Não possui	Aquelas plantas afiadas e rasteiras (艹) que indubitavelmente te podem (可) machucar a pele resultam num constante tormento e irritação.	N1
蓋	Tampa, cobertura	ガイ	ふた	O punhado de mato (艹) deixado desde o passado (去) no topo do enorme prato (皿) serve como uma rústica tampa e cobertura.	N1
盆	Bandeja, bacia	ボン	Não possui	Visando conseguir dividir e repartir (分) generosamente a bebida, optou-se por usar um prato grande (皿) como bandeja ou bacia.	N1
凶	Má sorte, atrocidade	キョウ	Não possui	A misteriosa caixa aberta (凵) exibindo no fundo a marca de uma perigosa armadilha e foice (乂) é sinal óbvio de má sorte e atrocidade.	N1
妃	Rainha, princesa	ヒ	Não possui	A imponente mulher (女) que clama sem receio a soberania do seu próprio sangue real (己) caminha soberana como rainha e princesa.	N1
庶	Plebeu, geral	ショ	Não possui	Instalados debaixo de um espaçoso galpão (广), vinte cidadãos (廿) aquecem-se na fogueira (灬), vivendo o quotidiano plebeu e geral.	N1
秩	Ordem, regularidade	チツ	Não possui	Quando o trigo e cereal (禾) são plantados de forma perfeita e a colheita não se perde (失), fica demonstrada uma imutável ordem e regularidade.	N1
裾	Bainha, sopé (da montanha)	キョ	すそ	O segmento inferior da roupa (衤) que habitualmente assenta e reside (居) na borda rasteira é a bainha, tal qual o sopé da montanha.	N1
幽	Recluso, obscuro	ユウ	Não possui	Isolados nas altas escarpas da montanha (山), pequenos e difusos fios pretos (幺) forjam um ambiente completamente recluso e obscuro.	N1
凡	Medíocre, comum	ボン, ハン	Não possui	Usar diariamente uma pequena mesinha rústica (几) adornada por um ínfimo grão de poeira (丶) é ter algo perfeitamente medíocre e comum.	N1
漠	Vago, deserto	バク, マク	Não possui	A terrível ausência de água (氵) sobre o seco pasto (艹) iluminado por um escaldante e grande (大) sol (日) compõe um cenário vago e deserto.	N1
拙	Desajeitado, inábil	セツ	つたな・い	Se a firme força da tua mão (扌) trabalha mas a obra pretendida nunca consegue emergir e sair (出), provas ter um talento desajeitado e inábil.	N1
恒	Constante, permanente	コウ, ゴウ	Não possui	O inabalável coração (忄) que repete o mesmo princípio dia após dia e alcança as distâncias (亘) mostra um valor constante e permanente.	N1
暦	Calendário	レキ	こよみ	Bem refugiado pelo paredão da rocha (厂) adjacente ao silencioso bosque (林), focas-te apenas na passagem do dia (日) para traçar o novo calendário.	N1
腫	Inchaço, tumor	シュ, ショウ	は・れる, は・らす	Uma determinada zona de carne e do corpo (月) que inusitadamente se apresenta inchada e pesada (重) denuncia um temeroso inchaço e tumor.	N1
峠	Passo de montanha	Não possui	とうげ	Ao cruzar o topo geográfico da montanha (山), o ponto exato de onde já não sobes (上) para enfim começares a descer (下) intitula-se o passo de montanha.	N1
宰	Supervisionar, gerenciar	サイ	Não possui	Organizado sob o seguro teto da autoridade (宀), resolver tarefas penosas e azedas (辛) constitui o penoso dever de supervisionar e gerenciar.	N1
蛮	Bárbaro	バン	えびす	Agir instintivamente e também (亦) deixar um rasto equiparável ao dos vorazes rastejantes e insetos (虫) denota claramente um perfil bárbaro.	N1
窮	Pobreza, extremo	キュウ	きわ・める, きわ・まる	Entrincheirado na escuridão do buraco (穴), a curvar o corpo (身) como um retorcido arco (弓) por falta de calor humano, sofres com a pobreza em extremo.	N1
擦	Esfregar, raspar	サツ	す・る, す・れる, こす・る, こす・れる	Apenas avançar intensamente com a mão (扌) após ponderar e observar bem o espaço sujo (察) é o modo correto de esfregar e raspar.	N1
爪	Unha, garra	ソウ	つめ, つま	A própria complexidade e curva desta antiga silhueta exposta em extremidades caninas ou felinas relata na perfeição uma perigosa unha e garra.	N1
稚	Imaturo, jovem	チ	Não possui	Se vês uma frágil e pequenina ave (隹) confusa em frente a um inofensivo e nutritivo grão (禾), percebes rapidamente que está a ser imaturo e jovem.	N1
辱	Humilhação, vergonha	ジョク	はずかし・める	Num espetáculo celestial onde ruge o dragão (辰), o artesão falha feio na precisão da métrica comum (寸), sentindo indescritível humilhação e vergonha.	N1
嵐	Tempestade	ラン	あらし	A pacífica imagem da montanha distante (山) sucumbe imediatamente quando as massas de ar aceleram num impiedoso vento (風), desatando uma tempestade.	N1
憤	Indignação, raiva	フン	いきどお・る	Quando um desesperado coração (忄) vasculha entre a abundante folhagem (卉) sem encontrar as suas valiosas conchas ou dinheiro (貝), emerge-lhe indignação e raiva.	N1
癒	Cura, curar	ユ	い・える, い・やす	Com muita união (亼), a doença (疒) tratada gradualmente (愈) à luz dos meses (月), usando até um bisturi (刂) para não ferir o coração (心), atinge a desejada cura e consegue curar.	N1
鬱	Melancolia, depressão	ウツ	うっ・する	Entre as árvores (木, 木), esconder uma lata (缶) sob a coberta (冖) numa caixa (凵) usando uma colher (匕) tapada com mato (彡) mostra uma profunda melancolia e depressão.	N1
疎	Escasso, distante	ソ	うと・い, うと・む	O bom rolo de tecido (疋) que precisa ser embalado no feixe (束) tornou-se repentinamente escasso e muito distante.	N1
雰	Atmosfera	フン	Não possui	A chuva (雨) que se divide (分) e se espalha finamente pelo ar cria uma pesada atmosfera.	N1
彰	Claro, manifesto	ショウ	Não possui	O belo brasão ou distintivo (章) adornado com finos traços (彡) de luz deixa o seu honrado dono claro e manifesto para todos.	N1
肺	Pulmão	ハイ	Não possui	A parte do corpo e da carne (月) que opera como o ativo mercado de uma cidade (市) trocando ar sem parar é o pulmão.	N1
傑	Proeminente, excelência	ケツ	Não possui	Uma pessoa (亻) que, mesmo com os pés cruzados e a dançar (舛) sobre o tronco da árvore (木) não cai, demonstra ter uma proeminente excelência.	N1
拘	Deter, restringir	コウ	かか・わる	A enérgica mão (扌) que aperta e agarra no ar a frase (句) confessada pelo suspeito serve para ajudar a deter e restringir o criminoso.	N1
頻	Frequência, repetidamente	ヒン	しき・りに	Caminhar no mesmo passo (歩) e balançar a cabeça (頁) concordando com imensa frequência e repetidamente.	N1
緯	Latitude, trama (tecido)	イ	Não possui	O resistente fio (糸) que habilmente se cruza com o pedaço de couro (韋) forma a trama do tecido e desenha a latitude do mapa.	N1
妖	Feitiçaria, estranho	ヨウ	あや・しい	A mulher (女) eternamente jovem (夭) que encanta misteriosamente os aldeões domina perfeitamente a arte do estranho e da feitiçaria.	N1
豚	Porco	トン	ぶた	A suculenta carne (月) cuidadosamente retirada e abatida do próprio suíno (豕) é evidentemente a saborosa carne de porco.	N1
藍	Índigo	ラン	あい	A intensa planta (艹) usada tradicionalmente para tingir a roupa do oficial que pode supervisionar (監) o povo apresenta a forte cor índigo.	N1
矛	Lança, alabarda	ム, ボウ	ほこ	A própria aparência de uma longa haste mortífera armada com um gancho curvo relata o inconfundível formato da lança ou alabarda.	N1
鍛	Forjar, treinar	タン	きた・える	Bater incessantemente no metal aquecido (金) acompanhando passo a passo cada degrau (段) do processo ajuda a forjar e treinar a lâmina.	N1
繊	Fino, delicado	セン	Não possui	Utilizar um mero fio (糸) e a arma afiada e pesada (戈) para tentar fatiar o alho selvagem (韯) requer sempre um toque muito fino e delicado.	N1
縫	Costurar	ホウ	ぬ・う	O bom fio (糸) que constantemente parece se encontrar (逢) e avançar pela rotação (辶) pelo tecido é precisamente o que te permite costurar as roupas.	N1
把	Agarrar, punhado	ハ	Não possui	A apressada mão (扌) a rodopiar velozmente num formato curvo (巴) tenta ansiosamente conseguir agarrar pelo menos um punhado daquelas coisas.	N1
楼	Torre, prédio alto	ロウ	Não possui	A maciça estrutura de madeira (木) erguida no centro, onde a mulher (女) empilha no topo todo o seu arroz (米) na cesta, é decerto um prédio alto ou torre.	N1
捉	Capturar, agarrar	ソク	とら・える	Combinando a rapidez veloz da mão (扌) com a incrível destreza firme do pé (足), o competente guarda militar conseguiu enfim capturar e agarrar o bandido.	N1
漬	Conserva, imergir	シ	つ・ける, つ・かる	A poderosa água mista (氵) que no jarro carrega a enorme responsabilidade (責) de manter os rústicos vegetais frescos origina a deliciosa conserva ao os imergir.	N1
紳	Cavalheiro	シン	Não possui	Um sábio homem trajando um fino cinto trançado de fio (糸) que serenamente relata (申) tudo com suprema educação é inegavelmente um autêntico cavalheiro.	N1
飽	Fartar-se, saciado	ホウ	あ・きる, あ・かす	O generoso e apertado pacote (包) repleto de farta comida quente (飠) entregue a ti vai ajudar-te perfeitamente a fartar-se e sentir-te logo saciado.	N1
宛	Destinatário, alocar	エン	あて	Sob o teto (宀) à noite (夕), a pessoa curvada (㔾) escreve para o destinatário e decide alocar a carta.	N1
閥	Facção, clã	バツ	Não possui	No portão (門), atacar (伐) os rivais é a regra suprema da nossa facção e clã.	N1
旋	Rotação, girar	セン	Não possui	Na direção (方) da bandeira (𠂉), o pé (疋) faz uma ágil rotação para girar.	N1
坪	Tsubo (medida de área)	ヘイ	つぼ	Um pedaço de terra (土) totalmente plano (平) mede exatamente a área de um tsubo.	N1
崖	Penhasco	ガイ	がけ	A montanha (山) sustentada pelo paredão de pedra (厂) e terra (土) é um perigoso penhasco.	N1
叱	Repreender, xingar	シツ	しか・る	A boca (口) a gritar o número sete (七) sem parar serve para repreender e xingar.	N1
鶏	Galinha, frango	ケイ	にわとり	A ave (鳥) de garras (爫) fortes que acorda o marido (夫) é a galinha e frango.	N1
峡	Desfiladeiro, ravina	キョウ	Não possui	A montanha (山) que tenta prensar e intercalar (夾) a passagem forma um desfiladeiro e ravina.	N1
溝	Fosso, vala	コウ	みぞ	A água (氵) que flui pela estrutura cruzada (冓) cria um eficiente fosso e vala.	N1
朴	Simples, plácido	ボク, ハク	Não possui	Usar a madeira (木) para rituais de adivinhação (卜) é um costume simples e plácido.	N1
軌	Trilho, rotina	キ	Não possui	O carro (車) que passa nove (九) vezes no mesmo lugar cria um trilho e uma rotina.	N1
瓦	Telha	ガ	かわら	O formato rústico desta cerâmica (瓦) descreve perfeitamente uma clássica telha.	N1
喪	Luto, perda	ソウ	も	Dez (十) bocas (口) a chorar sobre a roupa (衣) do falecido marcam o luto e a perda.	N1
墨	Tinta preta	ボク	すみ	A mistura do pó preto (黒) com a terra (土) forma a tradicional tinta preta.	N1
疫	Epidemia	エキ, ヤク	Não possui	A doença (疒) que ataca e atira (殳) as pessoas rapidamente transforma-se numa epidemia.	N1
遍	Por toda parte	ヘン	Não possui	Caminhar (辶) a divulgar um pergaminho plano (扁) para espalhar a mensagem por toda parte.	N1
濁	Turvo, impuro	ダク, ジョク	にご・る, にご・す	A água (氵) onde o inseto (蜀) caiu tornou-se espessa, turva e impura.	N1
扇	Leque, ventilador	セン	おうぎ	Uma porta (戸) decorada com penas (羽) movimenta o ar como um belo leque ou ventilador.	N1
拳	Punho	ケン	こぶし	Enrolar (龹) os dedos com firmeza na própria mão (手) forma um forte punho.	N1
乙	Elegante, segundo	オツ, イツ	Não possui	A curva (乙) deste traço revela o que é elegante e também assinala o segundo lugar.	N1
酵	Fermentação	コウ	Não possui	O licor (酉) feito com grande devoção filial (孝) passa por uma perfeita fermentação.	N1
堤	Dique, margem	テイ	つつみ	Usar terra (土) é inquestionavelmente o método certo (是) para erguer um dique e proteger a margem.	N1
阻	Obstruir, impedir	ソ	はば・む	A colina (阝) que, além do mais (且), é íngreme demais, serve apenas para obstruir e impedir o avanço.	N1
桑	Amoreira	ソウ	くわ	Usar a mão para ir novamente (又) colher os doces frutos na árvore (木) da amoreira.	N1
虏	Cativo, prisioneiro	リョ	Não possui	O homem (男) vigiado pelo grande tigre (虍) virou um indefeso cativo e prisioneiro.	N1
乞	Implorar, mendigar	コツ, キツ	こ・う	A pessoa curva (乙) levanta os braços (𠂉) tentando desesperadamente implorar e mendigar.	N1
恭	Respeito, reverente	キョウ	うやうや・しい	Com as mãos juntas (共) num sincero gesto do coração (㣺), demonstra-se respeito e um ar reverente.	N1
鐘	Sino	ショウ, シュ	かね	O pesado objeto de metal (金) tocado com entusiasmo pela criança (童) é o sino da torre.	N1
剰	Excedente, sobra	ジョウ	Não possui	Usar a espada (刂) para fatiar o que consegue embarcar (乗) deixa apenas o excedente e sobra.	N1
慈	Misericórdia, afeto	ジ	いつく・しむ	O coração (心) que atrai (茲) demonstra uma infinita misericórdia e afeto.	N1
径	Caminho, diâmetro	ケイ	Não possui	O passo (彳) da mão (又) que trabalha a terra (土) traça um longo caminho e diâmetro.	N1
培	Cultivar, nutrir	バイ, ホウ, ハイ	つちか・う	De pé (立) na terra (土), a boca (口) orienta como nutrir e cultivar o solo.	N1
擁	Abraçar, proteger	ヨウ	Não possui	Com a mão (扌), o teto (亠) protege o fio (幺) e o pássaro (隹) num gesto para abraçar e proteger.	N1
郭	Distrito, recinto	カク	Não possui	A colina (阝) que recebe todos com sucesso (亨) torna-se um próspero distrito e recinto.	N1
呪	Amaldiçoar, feitiço	ジュ, シュ, シュウ	のろ・う	A boca (口) do irmão mais velho (兄) profere palavras ruins para amaldiçoar e lançar um feitiço.	N1
砕	Esmagar, quebrar	サイ	くだ・く, くだ・ける	Bater na pedra (石) noventa (九, 十) vezes seguidas serve para a esmagar e quebrar.	N1
汰	Selecionar, peneirar	タ, タイ	Não possui	Usar uma quantidade grossa e muita (太) água (氵) ajuda a lavar, selecionar e peneirar as impurezas.	N1
勃	Erguer-se, súbito	ボツ, ホツ	Não possui	Dez (十) vezes sob o teto (冖), a criança (子) foca a sua força (力) para erguer-se de súbito.	N1
翁	Homem idoso, ancião	オウ	Não possui	O oficial público (公) que usa um manto de penas (羽) é um respeitado homem idoso e ancião.	N1
絹	Seda	ケン	きぬ	O fio (糸) que a boca (口) do inseto tece à luz da lua (月) forma a mais fina seda.	N1
譜	Partitura, linhagem	フ	Não possui	Palavras (言) e notas musicais dispostas de forma universal e comum (普) compõem uma rica partitura.	N1
陵	Mausoléu, colina	リョウ	みささぎ	A colina (阝) onde a terra é escavada e ultrapassada (夌) serve de majestoso mausoléu.	N1
痴	Tolo, estúpido	チ	Não possui	A doença (疒) que afeta o saber e conhecer (知) deixa o indivíduo tolo e estúpido.	N1
笛	Flauta	テキ	ふえ	O bambu (竹) é a verdadeira razão e origem (由) do doce som desta clássica flauta.	N1
昧	Obscuro, ignorante	マイ, バイ	Não possui	Quando o sol (日) ainda não (未) despontou e iluminou, tudo permanece obscuro e ignorante.	N1
訟	Processo judicial, litígio	ショウ	Não possui	Palavras (言) levadas ao espaço público (公) e oficial iniciam um sério processo judicial e litígio.	N1
唾	Saliva	ダ, タ	つば	O líquido da boca (口) que pode cair e pingar (垂) de forma natural é a saliva.	N1
肪	Gordura animal	ボウ, ホウ	Não possui	A parte do corpo e carne (月) que se acumula em toda a direção (方) é a gordura animal.	N1
塀	Muro, cerca	ヘイ	Não possui	A terra (土) do tamanho de um corpo (尸) moldada junta (并) e alinhada forma um resistente muro e cerca.	N1
碁	Go (jogo de tabuleiro)	ゴ	Não possui	Aquela (其) disposição exata de pedras (石) pretas e brancas forma o milenar jogo de Go.	N1
敢	Ousar, audaz	カン	あ・えて	No penhasco (𠂆), aquele que puxa a orelha (耳) do oponente e ataca (攵) prova ser audaz e ousar muito.	N1
塁	Base, forte	ルイ	Não possui	O antigo campo (田) erguido e reforçado com muita terra (土) serve de segura base e forte militar.	N1
暁	Amanhecer, aurora	ギョウ	あかつき	O sol (日) brilhando alto e eminente (尭) no céu escuro anuncia a aurora e o amanhecer.	N1
胴	Torso, tronco	ドウ	Não possui	A parte do corpo (月) que partilha e abriga os mesmos (同) órgãos vitais no centro é o torso e tronco.	N1
謡	Canto (Noh), balada	ヨウ	うたい, うた・う	As bonitas palavras (言) entoadas enquanto uma mão (爪) bate na lata (缶) criam uma balada e canto.	N1
飢	Fome, estar faminto	キ	う・える	Ver comida (飠) deixada inatingível numa mesa (几) distante causa terrível fome e deixa qualquer um faminto.	N1
欄	Coluna, corrimão	ラン	Não possui	A madeira (木) do portão (門) virado a leste (東) compõe de forma segura uma forte coluna e corrimão.	N1
艶	Sensual, brilhante	エン	つや	Uma abundante (豊) e exuberante cor (色) aplicada com cuidado torna tudo muito mais brilhante e sensual.	N1
痕	Cicatriz, marca	コン	あと	A ferida (疒) que resiste teimosamente (艮) na cicatrização da pele deixa no fim uma clara cicatriz e marca.	N1
怠	Negligência, preguiça	タイ	おこた・る, なま・ける	O coração (心) de quem só pensa em repousar sobre um pedestal (台) revela negligência e preguiça.	N1
欺	Engano, enganar	ギ	あざむ・く	Aquele (其) homem que finge um bocejo (欠) de fadiga quer de fato cometer um engano e enganar os outros.	N1
弦	Corda (de arco)	ゲン	つる	Presa fortemente no arco (弓), repousa uma misteriosa, enigmática e escura (玄) corda.	N1
泡	Bolha	ホウ	あわ	A fina água (氵) fechada envolvendo como um minúsculo pacote (包) cheio de ar gera uma frágil bolha.	N1
諦	Desistir	テイ	あきら・める	Sendo as palavras (言) finais e ditas pelo imperador (帝), só te resta aceitar a ordem e desistir.	N1
伐	Cortar (árvore), atacar	バツ	Não possui	A pessoa (亻) munida de uma afiada alabarda (戈) marcha rumo à floresta para atacar e cortar árvores.	N1
餅	Mochi (bolo de arroz)	ヘイ	もち	Juntar (并) intensamente e amassar os grãos desta comida (飠) gera o pegajoso bolo de arroz ou mochi.	N1
寮	Dormitório	リョウ	Não possui	Sob o espaçoso telhado (宀), cada colega (尞) descansa comodamente na sua cama de dormitório.	N1
厄	Azar, infortúnio	ヤク	Não possui	Refugiado debaixo do penhasco (厂), o homem curvado (㔾) chora o seu grande azar e infortúnio.	N1
奔	Correr agilmente, fugir	ホン	Não possui	A grande (大) dezena (十) de mãos (廾) avança em uníssono para fugir e correr agilmente para longe.	N1
瞳	Pupila (do olho)	ドウ	ひとみ	O vivo olho (目) admirado da jovem criança (童) atenta exibe uma imensa pupila.	N1
昆	Inseto, descendente	コン	Não possui	Debaixo do forte sol (日), torna-se fácil comparar (比) um minúsculo inseto e o seu descendente.	N1
椎	Carvalho, espinha	ツイ, スイ	Não possui	O pequeno pássaro (隹) repousa sobre a madeira (木) do carvalho com a firmeza de uma forte espinha dorsal.	N1
懇	Sociável, rogar	コン	ねんご・ろ	Um felino (豸) teimoso (艮) mas com bom coração (心) mostra-se sociável ao rogar e pedir carinho.	N1
唄	Canção	バイ	うた	A entusiasmada boca (口) de quem troca as suas preciosas conchas (貝) no mercado canta uma bela canção.	N1
渦	Redemoinho	カ	うず	A veloz água (氵) que flui de encontro a uma concavidade (咼) origina de imediato um forte redemoinho.	N1
襟	Colarinho, lapela	キン	えり	A roupa (衤) fechada rente e justa à zona de proibição (禁) do pescoço projeta um vistoso colarinho e lapela.	N1
吟	Recitar, versificar	ギン	Não possui	Usar a boca (口) agora (今) perante a plateia serve de inspiração para recitar e versificar doces cantos.	N1
覇	Hegemonia, supremo	ハ	Não possui	Focado no oeste (覀), com o seu escudo de couro (革) banhado pela lua (月), o guerreiro supremo alcança total hegemonia.	N1
衡	Equilíbrio, balança	コウ	Não possui	O grande (大) chifre (角) na linha (行) ajuda a manter o equilíbrio e a balança.	N1
呈	Apresentar, exibir	テイ	Não possui	O rei (王) abre a boca (口) para apresentar e exibir a sua ordem.	N1
隙	Brecha, fresta	ゲキ	すき	A colina (阝) com um pequeno (小) espaço branco (白) revela uma brecha e fresta.	N1
淫	Obsceno, lascivo	イン	みだ・ら	A água (氵) e a garra (爫) sobre o fardo (壬) escondem um ato obsceno e lascivo.	N1
娠	Gravidez	シン	Não possui	A mulher (女) sente a força do dragão (辰) no seu ventre durante a gravidez.	N1
循	Circular, seguir	ジュン	Não possui	O passo (彳) protegido pelo escudo (盾) serve para circular e seguir em frente.	N1
