Kanji	Significado	Leitura(s) ON	Leitura(s) KUN	Mnemônica	Nível JLPT
達	Alcançar, chegar a	タツ	たち, だち	Uma ovelha (羊) caminhando sobre a terra (土) por um caminho (辶) até alcançar.	N3
守	Proteger, obedecer	シュ, ス	まも・る, も・り	Usar uma pequena medida (寸) de cuidado sob o telhado (宀) para proteger.	N3
満	Cheio, completo	マン	み・ちる, み・たす	A água (氵) e a grama (艹) em ambos (両) os lados indicando que está cheio.	N3
消	Apagar, desaparecer	ショウ	き・える, け・す	A água (氵) e o brilho (⺌) sob a lua (月) fazem a chama apagar.	N3
任	Dever, deixar a cargo	ニン	まか・せる, まか・す	Uma pessoa (亻) que carrega o fardo de um oficial (壬) como seu dever.	N3
居	Residir, estar	キョ	い・る	Um corpo (尸) em um local velho (古) onde escolheu residir.	N3
予	Previamente, de antemão	ヨ	Não possui	O uso de uma ferramenta (マ) ou gancho (亅) preparado previamente.	N3
路	Caminho, rota	ロ	じ	Onde cada (各) pé (足) pisa para seguir um caminho.	N3
座	Assento, sentar	ザ	すわ・る	Pessoas sentadas na terra sob um abrigo (广) em seu assento.	N3
客	Visitante, cliente	キャク, カク	Não possui	Cada (各) pessoa que chega sob o telhado (宀) como um visitante.	N3
船	Navio, barco	セン	ふね, ふな	Um barco (舟) com divisões (八, 口) para formar um navio.	N3
追	Perseguir, seguir	ツイ	お・う	Seguir pelo caminho (辶) a trilha (㠯) para perseguir.	N3
背	Costas, estatura	ハイ	せ, せい, そむ・く, そむ・ける	Duas pessoas de costas (北) mostrando a forma do corpo (月) e sua estatura.	N3
観	Visão, aparência	カン	Não possui	Ver (見) as aves (隹) sob uma cobertura (廿, 冖) para ter uma visão.	N3
誰	Quem, alguém	Não possui	だれ	Usar palavras (言) para perguntar sobre a ave (隹) ou quem é.	N3
息	Respiração, filho	ソク	いき	O coração (心) e o nariz (自) trabalhando juntos na respiração.	N3
失	Perder, erro	シツ	うしな・う	Um traço (丿) que escapa do marido (夫) ao cometer um erro.	N3
老	Idoso, envelhecer	ロウ	お・いる, ふ・ける	Alguém que se apoia em um cajado (丿) sobre a terra (土) ao se tornar idoso (ヒ).	N3
良	Bom, excelente	リョウ	よ・い	Um ponto (丶) de limite (艮) que define o que é bom.	N3
示	Mostrar, indicar	ジ, シ	しめ・す	Colocar algo pequeno (小) sob duas linhas (二) para mostrar.	N3
号	Número, sinal	ゴウ	Não possui	Uma boca (口) que emite um som envolto (勹) em uma (一) ordem ou número.	N3
職	Emprego, profissão	ショク	Não possui	Ouvir (耳) o som (音) das armas ou ferramentas (戈) em seu emprego.	N3
王	Rei, governante	オウ	Não possui	Uma linha (丨) que une as três (三) camadas (céu, homem, terra) do rei.	N3
識	Conhecimento, discernimento	シキ	Não possui	Usar as palavras (言) sobre o som (音) e as ferramentas (戈) para obter conhecimento.	N3
警	Policiar, avisar	ケイ	Não possui	Usar palavras (言) com respeito (敬) para avisar ou policiar.	N3
優	Superior, gentil, ator	ユウ	やさ・しい, すぐ・れる	Uma pessoa (亻) que lida com a ansiedade (憂) de forma superior ou gentil.	N3
投	Arremessar, jogar	トウ	な・げる	Uma mão (扌) que usa uma ferramenta de golpe (殳) para arremessar.	N3
局	Departamento, agência	キョク	Não possui	Um corpo (尸) dentro do limite ou frase (句) de um departamento.	N3
難	Difícil, desastre	ナン	かた・い, むずか・しい	A ave (隹) presa em meio à vegetação (𦰩) em um momento difícil.	N3
種	Semente, tipo	シュ	たね	O grão (禾) que é pesado (重) e serve como semente.	N3
念	Pensamento, ideia	ネン	Não possui	O que está no coração (心) agora (今): uma ideia.	N3
寄	Aproximar-se, reunir	キ	よ・る, よ・せる	Coisas estranhas (奇) que se reúnem sob um telhado (宀) ao se aproximar.	N3
商	Comércio, negociar	ショウ	あきな・う	Ficar de pé (立) no cercado (冂) com divisões (八) e a boca (口) para o comércio.	N3
害	Dano, prejudicar	ガイ	Não possui	Palavras (口) e vegetação (丰) sob o telhado (宀) que causam dano.	N3
頼	Confiar, pedir	ライ	たの・む, たの・もしい, たよ・る	Um fardo (束) de papel (頁) que se entrega ao confiar em alguém.	N3
横	Lado, horizontal	オウ	よこ	A madeira (木) da cor amarela (黄) colocada de lado.	N3
増	Aumentar, adicionar	ゾウ, ソウ	ま・す, ふ・える, ふ・やす	Terra (土) que foi acumulada anteriormente (曾) para aumentar.	N3
差	Diferença, cruzar	サ	さ・す	Usar a mão esquerda (左) para segurar a ovelha (羊) e marcar a diferença.	N3
苦	Doloroso, sofrer, amargo	ク, コ	くる・しい, くる・しむ, くる・しめる, にが・い, にが・る	A grama (艹) que se tornou velha (古) e adquiriu um sabor amargo.	N3
収	Renda, obter, armazenar	シュウ	おさ・める, おさ・まる	Usar a mão (又) para prender (丩) os ganhos e obter renda.	N3
段	Degrau, nível, classificação	ダン, タン	Não possui	O uso de uma ferramenta de golpe (殳) para esculpir cada degrau.	N3
俺	Eu, mim (homens)	エン	おれ	Uma pessoa (亻) sob uma cobertura (奄) referindo-se a si mesma.	N3
渡	Cruzar, entregar	ト	わた・る, わた・す	A água (氵) que se percorre em um certo grau (度) para cruzar.	N3
与	Dar, conceder	ヨ	あた・える	Um (一) esforço (丂) para dar ou conceder algo.	N3
演	Apresentação, discurso	エン	Não possui	A água (氵) fluindo como as palavras de um oficial (寅) em uma apresentação.	N3
備	Preparar, prover, equipar	ビ	そな・える, そな・わる	Uma pessoa (亻) sob um abrigo (厂) que usa grama (艹) e ferramentas (用) para se preparar.	N3
申	Relatar, dizer humildemente	シン	もう・す	O sol (日) atravessado por uma linha vertical (丨) para relatar ou expandir algo humildemente.	N3
例	Exemplo, costume	レイ	たと・える	Uma pessoa (亻) que segue a fila (列) ou padrão para dar um exemplo.	N3
働	Trabalhar, funcionar	ドウ	はたら・く	Uma pessoa (亻) que entra em movimento (動) para trabalhar.	N3
景	Cena, vista, perspectiva	ケイ	Não possui	O sol (日) iluminando a capital (京) criando uma bela cena ou vista.	N3
抜	Puxar, arrancar	バツ	ぬ・く, ぬ・ける, ぬ・かす, ぬ・かる	Uma mão (扌) que usa a força de um amigo (友) para puxar ou arrancar algo.	N3
遠	Distante, longe	エン, オン	とお・い	Alguém que percorre um caminho (辶) longo sob o vestido ou manto (袁) para ir distante.	N3
絶	Cortar, interromper, absoluto	ゼツ, ゼチ, セツ	た・える, た・やす, た・つ	Usar o fio (糸) de uma cor (色) específica para cortar ou interromper uma conexão.	N3
負	Perder, carregar	フ	ま・ける, ま・かす, お・う	Uma pessoa ou garra (⺈) carregando conchas (貝) ou dinheiro, indicando que pode perder.	N3
福	Boa sorte, felicidade	フク	Não possui	Uma divindade ou deus (礻) que traz um jarro cheio (畐) de boa sorte.	N3
球	Bola, esfera	キュウ	たま	Uma joia (王) preciosa que se busca (求) na forma de uma bola.	N3
酒	Álcool, saquê	シュ	さけ, さか	A água (氵) guardada em um jarro de vinho (酉) para servir o saquê.	N3
君	Você, rei, sufixo de nome	クン	きみ	Um oficial (尹) que usa a boca (口) para dar ordens e se dirigir a você.	N3
察	Observar, adivinhar, investigar	サツ	Não possui	Sob um telhado (宀), realizar um festival ou ritual (祭) para observar e investigar.	N3
望	Esperança, desejar	ボウ, モウ	のぞ・む	O rei (王) que olha para a lua (月) após o pôr do sol (亡) com esperança.	N3
婚	Casamento	コン	Não possui	Uma mulher (女) que se une a alguém ao anoitecer (昏) no ato do casamento.	N3
単	Simples, único, unidade	タン	Não possui	O sol (日) surgindo sob o topo (丷) e a marca de dez (十) para algo simples ou único.	N3
押	Empurrar, pressionar	オウ	お・す, お・さえる	Uma mão (扌) que pressiona a armadura ou carapaça (甲) ao empurrar.	N3
割	Dividir, cortar, proporção	カツ	わ・る, わり, わ・れる, さ・く	Usar uma faca (刂) para separar o que causa dano (害) e fazer uma divisão.	N3
限	Limite, restringir	ゲン, カン	かぎ・る	Um local murado (阝) com um limite visual (艮) que define onde algo se restringe.	N3
戻	Retornar, devolver	レイ	もど・す, もど・る	Um cachorro grande (大) que tenta passar por uma porta (戸) para retornar.	N3
科	Departamento, matéria acadêmica	カ	Não possui	O grão (禾) medido com uma concha (斗) para definir o departamento ou matéria.	N3
求	Procurar, exigir, pedir	キュウ, グ	もと・める	O desenho da água (氺) em movimento com um ponto (丶) para procurar ou pedir algo.	N3
談	Conversa, discussão	ダン	Não possui	Usar as palavras (言) sob o calor das chamas (炎) em uma conversa.	N3
降	Descer, cair (chuva/neve)	コウ	お・りる, お・ろす, ふ・る	Em um local murado (阝), passos (彅) que indicam o ato de descer.	N3
妻	Esposa	サイ, セイ	つま	Uma mulher (女) com a mão (彐) segurando uma vassoura ou ferramenta (十) como esposa.	N3
岡	Colina, monte	コウ	おか	Uma montanha (山) dentro de um espaço (冂) representando uma colina.	N3
熱	Quente, calor, febre	ネツ	あつ・い	O calor das chamas (灬) aplicadas à terra ou formação (埶) para gerar calor.	N3
浮	Flutuar, subir à superfície	フ, フウ, ブ	う・く, う・かれる, う・かぶ, う・かべる	A água (氵) que sustenta uma criança ou semente (孚) para a fazer flutuar.	N3
等	Igual, classe, etc.	トウ	ひと・しい	Pedaços de bambu (竹) medidos em um templo (寺) para serem considerados iguais.	N3
末	Fim, último	マツ, バツ	すえ	Uma árvore (木) com um traço superior (一) maior, indicando a ponta ou o fim.	N3
幸	Felicidade, boa sorte	コウ	さいわ・い, さち, しあわ・せ	Sinais na terra (土) e ferramentas (丷, 干) que trazem felicidade e sorte.	N3
草	Grama, erva daninha	ソウ	くさ	A grama (艹) que surge cedo (早) na manhã.	N3
越	Cruzar, superar	エツ	こ・す, こ・える	Correr (走) segurando uma ferramenta de corte (戉) para cruzar ou superar.	N3
登	Subir, registrar	トウ, ト	のぼ・る	Os pés (癶) que sobem sobre um pedestal de feijão ou ritual (豆) para subir.	N3
類	Categoria, tipo	ルイ	たぐ・い	Grãos de arroz (米) e um ser grande (大) sob o topo (頁) de uma categoria.	N3
未	Ainda não	ミ, ビ	Não possui	Uma árvore (木) com o traço superior (一) menor, indicando que ainda não cresceu.	N3
規	Regra, medida	キ	Não possui	O marido ou homem (夫) que usa o olhar (見) para estabelecer a regra.	N3
精	Essência, refinar, energia	セイ, ショウ	Não possui	O arroz (米) que se mantém fresco ou azul (青) como sua essência.	N3
抱	Abraçar, segurar	ホウ	だ・く, いだ・く, かか・える	Uma mão (扌) que envolve algo em um pacote (包) ao abraçar.	N3
労	Trabalho, fadiga	ロウ	Não possui	O esforço sob um topo e cobertura (⺍, 冖) usando a força (力) gera fadiga.	N3
処	Lidar com, lugar	ショ	Não possui	Caminhar devagar (夂) até um banco ou suporte (几) para lidar com algo.	N3
退	Recuar, afastar	タイ	しりぞ・く, しりぞ・ける	Percorrer um caminho (辶) de volta a um ponto de limite (艮) ao recuar.	N3
費	Despesa, custo	ヒ	つい・やす, つい・える	O uso de dinheiro ou conchas (貝) para remover o excesso (弗) em uma despesa.	N3
非	Erro, negativo	ヒ	Não possui	Representação visual de asas ou linhas opostas para indicar o negativo ou erro.	N3
喜	Feliz, alegrar-se	キ	よろこ・ぶ	Um oficial (士) que usa a boca (口) e música (丷, 一, 口) para se sentir feliz.	N3
娘	Filha, jovem	ジョウ	むすめ	Uma mulher (女) que é considerada boa (良) por ser a filha.	N3
逃	Escapar, fugir	トウ	に・げる, に・がす, のが・す, のが・れる	Percorrer o caminho (辶) ao ver o sinal (兆) de perigo para fugir.	N3
探	Procurar, explorar	タン	さぐ・る, さが・す	Uma mão (扌) sob uma cobertura (冖) buscando entre ramos e madeira (八, 木) ao procurar.	N3
犯	Crime, cometer	ハン, ボン	おか・す	Um animal ou cão (犭) que ataca um oficial (㔾) ao cometer um crime.	N3
薬	Remédio, química	ヤク	くすり	Grama (艹) que traz a alegria da música (楽) ao curar: o remédio.	N3
園	Jardim, parque	エン	その	Um espaço cercado (囗) onde se usa um longo manto (袁) para passear no jardim.	N3
疑	Dúvida, suspeita	ギ	うたが・う	Alguém parado (疋) com uma flecha (矢) e uma faca (匕, マ) sem saber o que fazer: dúvida.	N3
緒	Começo, cordão	ショ, チョ	お	O fio (糸) que uma pessoa (者) segura para dar o início ou cordão.	N3
静	Silencioso, calmo	セイ, ジョウ	しず, しず・か, しず・まる, しず・める	Manter a cor fresca (青) e evitar a disputa (争) para ficar silencioso.	N3
具	Ferramenta, ingrediente	グ	Não possui	Um olho (目) observando a base (一) e as partes (八) de uma ferramenta.	N3
席	Assento, lugar	セキ	Não possui	Um pano (巾) sob um abrigo (广) repetido (廿) para marcar o assento.	N3
速	Rápido	ソク	はや・い, はや・める, はや・まる, すみ・やか	Percorrer o caminho (辶) segurando um fardo (束) com velocidade: rápido.	N3
舞	Dança	ブ	ま・う, まい	O movimento dos pés opostos (舛) em um local onde nada (無) mais importa: a dança.	N3
宿	Hospedagem, pousada	シュク, スク	やど, やど・る, やど・す	Cem (百) pessoas (亻) abrigadas sob um telhado (宀) em uma pousada.	N3
程	Grau, extensão	テイ	ほど	Medir o grão (禾) e o apresentar (呈) para definir o grau ou extensão.	N3
倒	Tombar, cair	トウ	たお・れる, たお・す	Uma pessoa (亻) que ao chegar (到) ao seu limite acaba por tombar.	N3
寝	Dormir, deitar	シン	ね・る, ね・かす	Sob um telhado (宀), deitar o corpo (丬) e usar a mão (彐, 又) ao dormir.	N3
宅	Casa, lar	タク	Não possui	Uma planta (乇) que cria raízes sob um telhado (宀) marcando a sua casa.	N3
絵	Imagem, pintura	カイ, エ	Não possui	Fios (糸) que se encontram (会) para formar uma pintura ou imagem.	N3
破	Quebrar, rasgar	ハ	やぶ・る, やぶ・れる	Usar uma pedra (石) para arrancar a pele (皮) ou quebrar algo.	N3
庭	Jardim, quintal	テイ	にわ	Um abrigo (广) diante de um tribunal ou corte (廷) formando um quintal.	N3
婦	Mulher, esposa	フ	Não possui	Uma mulher (女) segurando uma vassoura (帚) como esposa ou dona de casa.	N3
余	Excesso, sobrar	ヨ	あま・る, あま・す	Uma pessoa (人) sob um pequeno (小) telhado (一) que tem algo em excesso.	N3
訪	Visitar	ホウ	おとず・れる, たず・ねる	Usar as palavras (言) em uma direção (方) específica ao visitar alguém.	N3
冷	Frio, frieza	レイ, リョウ	つめ・たい, ひ・える, ひ・や, ひ・やす, ひ・やかす, さ・める, さ・ます	O gelo (冫) que segue a ordem (令) da temperatura para ficar frio.	N3
暮	Viver, escurecer	ボ	く・れる, く・らす	O sol (日) se pondo entre a grama (艹) de forma grande (大) enquanto se vive.	N3
腹	Barriga, coração	フク	はら	O corpo (月) de alguém (𠂉) que após o dia (日) caminha (夂) com a barriga cheia.	N3
危	Perigo, medo	キ	あぶ・ない, あや・うい, あや・ぶむ	Uma pessoa (⺈) na beira de um penhasco (厂) prestes a cair (㔾): perigo.	N3
許	Permitir, perdoar	キョ, コ	ゆる・す	Usar as palavras (言) no meio-dia (午) para conceder um perdão ou permitir.	N3
似	Semelhança	ジ	に・る	Uma pessoa (亻) que age por meio de (以) outra devido à semelhança.	N3
険	Perigo, íngreme	ケン	けわ・しい	Um local murado (阝) onde muitas pessoas (僉) se reúnem em um local íngreme.	N3
財	Propriedade, riqueza	ザイ, サイ	Não possui	O talento (才) usado para obter conchas (貝) e formar riqueza.	N3
遊	Brincar, viajar	ユウ, ユ	あそ・ぶ	Percorrer o caminho (辶) em diversas direções (方) como uma criança (子) ao brincar.	N3
雑	Diversos, misturado	ザツ, ゾウ	Não possui	Pássaros (隹) e nove (九) tipos de madeira (木) misturados em algo diverso.	N3
恐	Medo, pavor	キョウ	おそ・れる, おそ・ろしい	O coração (心) que sente o peso do trabalho (工) comum (凡) e gera medo.	N3
値	Valor, preço	チ	ね, あたい	Uma pessoa (亻) que verifica diretamente (直) o preço para saber o valor.	N3
暗	Escuro, escondido	アン	くら・い	O sol (日) que se foi, restando apenas o som (音) no escuro.	N3
積	Acumulação, produto	セキ, シ, シャク	つ・む, つ・もる	O grão (禾) coletado sob a responsabilidade (責) de se acumular.	N3
夢	Sonho, visão	ム	ゆめ	Sob a grama (艹) e a rede (罒) da noite (夕), o telhado (冖) protege o sonho.	N3
痛	Dor	ツウ	いた・い, いた・む, いた・める	Alguém doente (疒) que sente algo percorrer (甬) o corpo como uma dor.	N3
富	Rico, riqueza	フ, フウ	と・む, とみ	Sob o telhado (宀), ter uma (一) boca (口) e um campo (田) para ser rico.	N3
刻	Esculpir, tempo	コク	きざ・む	Usar uma faca (刂) para marcar o tempo no signo do porco (亥) ao escrevê-lo.	N3
鳴	Cantar, fazer som	メイ	な・く, な・る, な・らす	A boca (口) de um pássaro (鳥) ao emitir seu canto.	N3
欲	Desejo	ヨク	ほっ・する, ほ・しい	Abrir a boca (欠) diante de um vale (谷) profundo devido ao desejo.	N3
途	Rota, caminho	ト	Não possui	O caminho (辶) que sobra (余) para se percorrer em uma rota.	N3
曲	Música, curvar	キョク	ま・がる, ま・げる	O desenho de um objeto curvo (卄) dentro de um espaço (冂) que representa a melodia.	N3
耳	Orelha, audição	ジ	みみ	Representação visual da orelha e da audição humana.	N3
完	Perfeito, completo	カン	Não possui	Sob o telhado (宀), o que vem da origem (元) de forma completa.	N3
願	Pedido, desejo	ガン	ねが・う	O rosto (頁) que se volta para a origem (原) ao fazer um pedido.	N3
罪	Crime, pecado	ザイ	つみ	Estar preso em uma rede (罒) por cometer um erro ou negativo (非).	N3
陽	Sol, positivo	ヨウ	Não possui	Um local murado (阝) onde o sol nasce (旦) sem nada (勿) o encobrir.	N3
亡	Morrer, arruinar	ボウ, モウ	な・い	Algo que se esconde (乚) sob um topo (亠) ao desaparecer ou morrer.	N3
散	Espalhar, desordem	サン	ち・る, ち・らす, ち・らかす, ち・らかる	Usar a força (攵) para espalhar a grama (艹) sob a luz da lua (月).	N3
掛	Pendurar, depender de	Não possui	か・ける, か・かる, かかり	Uma mão (扌) que coloca uma joia (圭) seguindo um sinal (卜) ao pendurar.	N3
昨	Ontem, passado	サク	Não possui	O sol (日) que passou de forma súbita (乍), representando o ontem.	N3
怒	Raiva	ド	いか・る, おこ・る	O coração (心) de uma mulher (女) sob pressão (又) que explode em raiva.	N3
留	Manter no lugar, ficar	リュウ, ル	と・める, と・まる	Portões (卯) colocados para manter o gado no campo (田) ou ficar no lugar.	N3
礼	Etiqueta, reverência	レイ, ライ	Não possui	Diante de um altar (礻), fazer o gesto (乚) de reverência e etiqueta.	N3
列	Fila, fileira	レツ	Não possui	Usar uma faca (刂) para organizar restos (歹) em uma fileira ou fila.	N3
雪	Neve	セツ	ゆき	A chuva (雨) que pode ser pega com a mão (彐) na forma de neve.	N3
払	Pagar, varrer	フツ	はら・う	Uma mão (扌) que move algo privado (厶) para pagar ou varrer.	N3
給	Salário, fornecer	キュウ	Não possui	Unir fios (糸) que se encaixam (合) para fornecer o sustento ou salário.	N3
敗	Fracasso, derrota	ハイ	やぶ・れる	O dinheiro (貝) que é atingido por um golpe (攵) resultando em derrota.	N3
捕	Pegar, prender	ホ	と・らえる, と・らわれる, と・る, つか・まえる, つか・まる	Usar a mão (扌) para segurar algo que brota ao prender ou pegar.	N3
忘	Esquecer	ボウ, モウ	わす・れる	Quando algo morre (亡) no coração (心), a pessoa acaba por esquecer.	N3
晴	Clarear, tempo bom	セイ	は・れる, は・らす	O sol (日) brilhando em um céu azul ou fresco (青) indicando tempo bom.	N3
因	Causa, fator	イン	よ・る	Um motivo grande (大) preso dentro de um cercado (囗) como a causa de algo.	N3
折	Dobrar, quebrar	セツ	お・る, おり, お・れる	Usar a mão (扌) e um machado (斤) para quebrar ou dobrar a madeira.	N3
迎	Dar as boas-vindas, receber	ゲイ	むか・える	Alguém que olha para cima e percorre o caminho (辶) para dar as boas-vindas.	N3
悲	Tristeza, entristecer	ヒ	かな・しい, かな・しむ	Quando o negativo (非) atinge o coração (心), surge a tristeza.	N3
港	Porto	コウ	みなと	O local onde a água (氵) encontra as ruelas (巷) da cidade: o porto.	N3
責	Culpa, responsabilidade	セキ, シャク	せ・める	A planta (龶) que cresce sobre o dinheiro (貝) representando uma culpa ou dívida.	N3
除	Excluir, remover	ジョ, ジ	のぞ・く	Remover o excesso (余) para fora dos muros (阝) da cidade ao excluir.	N3
困	Estar em apuros, problema	コン	こま・る	Uma árvore (木) presa dentro de um cercado (囗) sem espaço: estar em apuros.	N3
閉	Fechar	ヘイ	と・じる, と・ざす, し・める, し・まる	Usar uma ferramenta (才) para trancar o portão (門) e fechar.	N3
吸	Sugar, inalar	キュウ	す・う	Usar a boca (口) para alcançar (及) o ar ou líquido ao sugar.	N3
髪	Cabelo	ハツ	かみ	Amigos (友) que cuidam dos ornamentos (彡) nos cabelos longos.	N3
束	Feixe, amarrar	ソク	たば	Uma árvore (木) com um cercado (口) no meio para amarrar um feixe.	N3
眠	Dormir, sono	ミン, ベン	ねむ・る, ねむ・い	Quando o olho (目) do povo (民) se fecha para o descanso do sono.	N3
易	Fácil, troca	エキ, イ	やさ・しい	O sol (日) envolto (勹) que passa (丿) em uma troca rápida e fácil.	N3
窓	Janela	ソウ	まど	Um buraco (穴) privado (厶) que permite ao coração (心) ver pela janela.	N3
祖	Antepassado, avô	ソ	Não possui	Diante de um altar (礻) sobre outro (且) para honrar o antepassado.	N3
勤	Diligência, trabalhar para	キン, ゴン	つと・める, つと・まる	Usar a boca (口) e a força (力) na grama (艹) em um trabalho diligente.	N3
昔	Tempos antigos, passado	セキ, シャク	むかし	O sol (日) que passou por vinte gerações (廿) em tempos antigos.	N3
便	Conveniente, correio	ベン, ビン	たよ・り	Uma pessoa (亻) que muda (更) algo para o correio ou entrega conveniente.	N3
適	Adequado, apropriado	テキ	Não possui	Seguir pelo caminho (辶) que leva à base ou caule (啇) adequado.	N3
吹	Soprar	スイ	ふ・く	Abrir a boca (口) como em um bocejo (欠) para soprar o ar.	N3
候	Clima, aguardar	コウ	そうろう	Uma pessoa (亻) que observa o alvo e aguarda a mudança do clima.	N3
怖	Medo, assustador	フ	こわ・い	O coração (忄) que se torna como um pano (布) trêmulo devido ao medo.	N3
辞	Palavra, renunciar	ジ	や・める	Usar a língua (舌) em situação difícil (辛) para dizer uma palavra ou renunciar.	N3
否	Negar, não	ヒ	いな	Usar a boca (口) para dizer o não (不) e negar algo.	N3
遅	Lento, tarde	チ	おく・れる, おく・らす, おそ・い	Um corpo (尸) de ovelha (羊) que percorre o caminho (辶) de forma lenta.	N3
煙	Fumaça	エン	けむ・る, けむり, けむ・い	O fogo (火) sob uma cobertura (覀) de terra (土) que gera fumaça.	N3
徒	Seguidor, a pé	ト	Não possui	Dar passos (彳) ao correr (走) como um seguidor que vai a pé.	N3
欠	Falta, bocejo	ケツ	か・ける, か・く	Representação de uma pessoa com a boca aberta devido a um bocejo ou falta.	N3
迷	Perder-se, perplexo	メイ	まよ・う	Espalhar arroz (米) pelo caminho (辶) para não se perder.	N3
洗	Lavar	セン	あら・う	O uso da água (氵) para limpar o que estava antes (先) ao lavar.	N3
互	Mútuo	ゴ	たが・い	Desenho de dois ganchos que se entrelaçam representando algo mútuo.	N3
才	Talento, gênio	サイ	Não possui	Representação de uma planta brotando que simboliza o talento nato.	N3
更	Mudar, tarde da noite	コウ	さら, ふ・ける, ふ・かす	Quando o dia (日) se cruza (乂) com o fim, marcando o mudar da noite.	N3
歯	Dente	シ	は	O que para (止) na boca (口) para mastigar o arroz (米): o dente.	N3
盗	Roubar	トウ	ぬす・む	Desejar o próximo (次) prato (皿) de comida a ponto de roubar.	N3
慣	Acostumar-se, hábito	カン	な・れる, な・らす	O que atravessa (貫) e permanece no coração (忄) como um hábito.	N3
晩	Noite, anoitecer	バン	Não possui	Quando o sol (日) escapa (免) do horizonte, marcando o anoitecer.	N3
箱	Caixa	ソウ	はこ	Uma caixa feita de bambu (竹) para guardar objetos com boa aparência (相).,,	N3
到	Chegar, atingir	トウ	いた・る	O ato de chegar (至) ao seu limite e usar uma faca (刂) para atingir o objetivo.,	N3
頂	Topo, receber	チョウ	いただ・く, いただき	O ponto mais alto ou topo da cabeça (頁) em uma seção (丁) do corpo.,	N3
杯	Copo, taça	ハイ	さかずき	Um recipiente de madeira (木) que não (不) deixa o líquido cair: o copo.,	N3
皆	Todos	カイ	みな	Comparar (比) várias pessoas sob a luz branca (白) para ver que estão todos lá.,	N3
招	Convidar, chamar	ショウ	まね・く	Usar a mão (扌) para convocar (召) alguém e a convidar.,	N3
寒	Frio	カン	さむ・い	Sob o telhado (宀), a grama (廿) e o poço (井) estão cobertos de gelo (冫) pelo frio.,,	N3
恥	Vergonha	チ	は・じる, はじ, は・じらう, は・ずかしい	Quando a orelha (耳) fica vermelha e o coração (心) bate forte devido à vergonha.,	N3
疲	Cansado, fadiga	ヒ	つか・れる	Uma doença (疒) que afeta a pele (皮) e deixa a pessoa sentindo-se cansada.,,	N3
貧	Pobre, pobreza	ヒン, ビン	まず・しい	Dividir (分) as poucas conchas ou dinheiro (貝) que restam na pobreza.,,	N3
猫	Gato	ビョウ	ねこ	Um animal (犭) que se esconde entre as mudas (苗) de plantas: o gato.,	N3
