Kanji	Significado	Leitura(s) ON	Leitura(s) KUN	Mnemônica	Nível JLPT
康	Saúde, pacífico	コウ	Não possui	Sob um abrigo (广), usar a mão (隶) para manter as coisas em ordem e garantir a saúde.	N1
沢	Pântano, abundância	タク	さわ	Água (氵) que atinge uma certa medida (尺) e se torna um pântano em abundância.	N1
秀	Excelência, superar	シュウ, シュ	ひい・でる	Os grãos (禾) que brotam (乃) com vigor mostram a sua excelência ou superioridade.	N1
興	Interesse, entretenimento	コウ, キョウ	おこ・る, おこ・す	Usar as mãos (八) no almofariz (臼) de forma igual (同) para gerar interesse ou entretenimento.	N1
率	Taxa, proporção	ソツ, リツ, スイ, シュツ	ひき・いる	O mistério (玄) de usar pequenos (幺) fios sob o gelo (冫) para medir a taxa de dez (十).	N1
評	Avaliação, crítica	ヒョウ, ヘイ	Não possui	Usar palavras (言) para deixar o assunto plano (平) e nivelado ao fazer uma avaliação.	N1
監	Supervisionar	カン, ケン	Não possui	O retentor (臣) que observa o sangue (血) no prato (皿) para supervisionar.	N1
崎	Promontório, península	キ	さき	Uma montanha (山) com uma forma estranha (奇) que se projeta como um promontório.	N1
鮮	Fresco, vívido	セン	あざ・やか	O peixe (魚) e a ovelha (羊) servidos juntos enquanto ainda estão em estado fresco.	N1
激	Intenso, violento	ゲキ	はげ・しい	A água (氵) que atinge algo e emite um brilho (敫) de forma intensa ou violenta.	N1
徳	Virtude	トク	Não possui	Caminhar (彳) seguindo dez (十) preceitos sob a rede (罒) de um (一) coração (心).	N1
挙	Erguer, levantar	キョ	あ・げる, あ・がる	Sob o brilho (⺍), usar as duas mãos (八, 手) para erguer ou levantar algo.	N1
志	Intenção, ambição	シ	こころざ・す, こころざし	O coração (心) de um oficial ou samurai (士) que carrega uma grande intenção.	N1
敷	Espalhar, pavimentar	フ	し・く	No campo (田), tomar a ação (攵) em cada direção (方) para espalhar a terra.	N1
系	Sistema, linhagem	ケイ	Não possui	O traço (丿) que define a continuidade dos fios (糸) em um sistema ou linhagem.	N1
織	Tecer, tecido	シキ, ショク	お・る	Unir os fios (糸) ao som (音) das ferramentas e lanças (戈) para tecer um tecido.	N1
製	Fabricação	セイ	Não possui	O sistema de corte (制) aplicado à roupa (衣) durante a sua fabricação.	N1
端	Borda, extremidade	タン	はし, は, はた	Ficar de pé (立) na montanha (山) sobre a base (而) marcando a borda.	N1
遺	Deixar para trás, legado	イ, ユイ	Não possui	Caminhar (辶) levando o que é precioso (貴) como um legado a ser deixado para trás.	N1
房	Quarto, cacho	ボウ	ふさ	Uma porta (戸) que se abre para uma direção (方) específica de um quarto.	N1
街	Rua, cidade	ガイ, カイ	まち	Caminhar (彳) sobre a terra (圭) firme ao longo da rua principal da cidade (亍).	N1
尾	Cauda, rabo	ビ	お	O corpo (尸) de um animal que termina em um longo pelo (毛) ou cauda.	N1
株	Ações (finanças), toco	シュ	かぶ	A árvore (木) cujo centro (朱) ou toco permanece como a base das ações.	N1
従	Seguir, obedecer	ジュウ, ショウ, ジュ	したが・う, したが・える	Caminhar (彳) seguindo os pés (疋) de alguém para obedecer ou seguir.	N1
敵	Inimigo, oponente	テキ	かたき	A ação (攵) de um imperador (帝) que se volta contra o seu inimigo.	N1
展	Exposição, desenvolver	テン	Não possui	O corpo (尸) coberto por vinte (廿) camadas de roupa (衣) em uma exposição.	N1
描	Desenhar, retratar	ビョウ	えが・く, か・く	Usar a mão (扌) para retratar as mudas (苗) de plantas ao desenhar.	N1
修	Estudar, consertar	シュウ, シュ	おさ・める, おさ・まる	Uma pessoa (亻) que toma a ação (攵) de usar ornamentos (彡) para consertar.	N1
我	Eu, ego	ガ	われ, わ	Usar a mão (手) para segurar a lança (戈) e defender o meu eu ou ego.	N1
載	Carregar, publicar	サイ	の・せる, の・る	Usar uma ferramenta (戈) para colocar dez (十) itens sobre um carro (車) e carregar.	N1
響	Eco, ressoar	キョウ	ひび・く	O som (音) que vem da sua terra natal (郷) e faz tudo ressoar.	N1
秘	Segredo, escondido	ヒ	ひ・める	Guardar os grãos (禾) de forma certa (必) em um local escondido ou segredo.	N1
攻	Ataque	コウ, ク	せ・める	O trabalho (工) de tomar a ação (攵) agressiva em um ataque.	N1
健	Saúde, saudável	ケン	すこ・やか	Uma pessoa (亻) que tem a força de quem sabe construir (建) sua própria saúde.	N1
裁	Julgar, cortar (tecido)	サイ	た・つ, さば・く	Usar a ferramenta (戈) para medir dez (十) partes da roupa (衣) ao julgar.	N1
隠	Esconder	イン, オン	かく・す, かく・れる	Atrás de um muro (阝), o coração (心) que se recolhe para se esconder.	N1
環	Anel, envolver	カン	Não possui	Uma joia (王) em formato de anel que o olho (罒) vê sobre a roupa (衣).	N1
援	Ajuda, assistência	エン	Não possui	Usar a mão (扌) para dar auxílio (爰) e prestar assistência.	N1
故	Falecido, razão	コ	ゆえ	Tomar a ação (攵) de honrar o que é velho (古) ou falecido por uma razão.	N1
幕	Cortina, xogunato	マク, バク	Não possui	Sob a grama (艹) e o sol (日), usar um pano (巾) grande (大) como cortina.	N1
督	Supervisionar	トク	Não possui	O olho (目) do tio ou ancião (叔) que vigia para supervisionar.	N1
倉	Armazém	ソウ	くら	Um telhado (亼) sobre uma porta (戸) e um recipiente (口) para formar um armazém.	N1
施	Executar, conceder	シ, セ	ほどこ・す	Seguir a direção (方) da superfície (也) plana para executar ou conceder algo.	N1
嫌	Detestar	ケン, ゲン	きら・う, いや	A mulher (女) que tenta juntar (兼) coisas que não combinam, gerando o ato de detestar.	N1
継	Suceder, herdar	ケイ	つ・ぐ	Usar o fio (糸) para continuar (㡭) a linhagem ao suceder.	N1
障	Obstáculo, barreira	ショウ	さわ・る	Um muro (阝) marcado com um capítulo ou sinal (章) que serve de obstáculo.	N1
貴	Precioso, nobre	キ	たっと・い, とうと・い, たっと・ぶ, とうと・ぶ	Uma (一) concha de dinheiro (貝) guardada no centro (中) por ser preciosa.	N1
整	Arrumar, organizar	セイ	ととの・える, ととの・う	Usar a força (攵) para deixar o feixe (束) de forma correta (正) ao organizar.	N1
衆	Multidão, o público	シュウ, シュ	Não possui	O sangue (血) compartilhado por muitas pessoas (乑) em uma multidão.	N1
及	Alcançar, estender-se	キュウ	およ・ぶ, およ・び, およ・ぼす	Uma pessoa (丿) que usa a mão (又) para se esticar (乃) e alcançar algo.	N1
盛	Prosperar, servir	セイ, ジョウ	も・る, さか・る, さか・ん	O que se torna (成) cheio em um prato (皿) para prosperar.	N1
玄	Misterioso, escuridão	ゲン	Não possui	Um fio (幺) sob um topo (亠) representando a escuridão ou o misterioso.	N1
恵	Bênção, favor	ケイ, エ	めぐ・む	Dez (十) campos (田) de coração (心) que trazem uma bênção.	N1
授	Conferir, ensinar	ジュ	さず・ける, さず・かる	Uma mão (扌) que ajuda a receber (受) um presente ao conferir ou ensinar.	N1
弾	Projétil, tocar, saltar	ダン	ひ・く, はず・む, たま	Usar o arco (弓) para disparar um projétil de forma simples (単).	N1
養	Nutrir, criar	ヨウ	やしな・う	Uma ovelha (羊) servida como comida (食) para nutrir ou criar.	N1
驚	Surpreender, assustar	キョウ	おどろ・く, おどろ・かす	O respeito (敬) demonstrado por um cavalo (馬) ao se surpreender.	N1
奈	Nara, som de Na	ナ, ナイ, ダイ	Não possui	Alguém grande (大) diante de um altar (示) na antiga cidade de Nara.	N1
推	Recomendar, impulsionar	スイ	お・す	Uma mão (扌) que apresenta a ave (隹) para a recomendar ou impulsionar.	N1
樹	Árvore	ジュ	Não possui	Uma árvore (木) de grande medida (寸) em um local de tambores (壴).	N1
為	Ação, em prol de	イ	ため, な・る, な・す	Uma garra (爪) e o fogo (灬) agindo em prol de uma ação.	N1
雄	Macho, magnífico	ユウ	お, おす	Uma ave (隹) de asas amplas (厷) que é um macho magnífico.	N1
刀	Espada	トウ	かたな	Representação visual e simples de uma espada ou lâmina.	N1
弁	Discurso, dialeto, válvula	ベン	Não possui	Um discurso ou dialeto feito por mãos (廾) em um local privado (厶).	N1
妙	Estranho, maravilhoso	ミョウ	Não possui	Uma mulher (女) com pouca (少) idade que é estranha ou maravilhosa.	N1
模	Modelo, padrão	モ, ボ	Não possui	Uma árvore (木) vista sob o pôr do sol (莫) servindo de modelo.	N1
抗	Opor-se, anti-	コウ	Não possui	Uma mão (扌) que se levanta alto (亢) para se opor a algo.	N1
級	Grau, classe	キュウ	Não possui	Fios (糸) que servem para alcançar (及) o próximo grau ou classe.	N1
瞬	Piscar, momento	シュン	またた・く	O olho (目) que se fecha em um momento rápido ao piscar.	N1
称	Nomear, título	ショウ	Não possui	Grãos (禾) que recebem um nome ou título ao serem nomeados.	N1
華	Esplêndido, flor, China	カ, ケ	はな	Grama (艹) que cai (垂) de forma esplêndida e brilhante.	N1
傷	Ferimento, dano	ショウ	きず, いた・む, いた・める	Uma pessoa (亻) que sofre um brilho (昜) ou calor que causa um ferimento.	N1
闘	Lutar, competir	トウ	たたか・う	No portão (門), lutar por uma medida (寸) de feijão (豆).	N1
筋	Músculo, enredo	キン	すじ	Bambu (竹) e corpo (月) que usam a força (力) do músculo.	N1
訳	Tradução, motivo	ヤク	わけ	Palavras (言) que medem (尺) o motivo ou sentido em uma tradução.	N1
射	Atirar	シャ	い・る	O corpo (身) que usa uma medida (寸) de força para atirar.	N1
善	Bom, bondade	ゼン	よ・い	Uma ovelha (羊) e uma boca (口) que expressam a bondade.	N1
黙	Silêncio	モク, ボク	だま・る	Um cachorro (犬) preto (黒) que se mantém em absoluto silêncio.	N1
柄	Padrão, cabo	ヘイ	がら, え	Uma árvore (木) com o padrão ou cabo da classe C (丙).	N1
刑	Punição criminal	ケイ	Não possui	Usar a faca (刂) para abrir (开) uma punição criminal.	N1
節	Articulação, nó, estação	セツ, セチ	ふし	Bambu (竹) usado imediatamente (即) em uma articulação ou nó.	N1
脱	Despir-se, escapar	ダツ	ぬ・ぐ, ぬ・げる	O corpo (月) que se abre para escapar (兑) e despir-se.	N1
厳	Rigoroso, severo	ゲン, ゴン	おごそ・か, きび・しい	Brilho (⺍) sob o penhasco (厂) onde se ousa (敢) ser severo ou rigoroso.	N1
博	Amplo, Ph.D.	ハク, バク	Não possui	Dez (十) medidas (寸) em um campo (甫) de amplo conhecimento.	N1
陣	Formação de batalha	ジン	Não possui	Um carro (車) posicionado no muro (阝) em uma formação de batalha.	N1
奇	Extraordinário, ímpar	キ	Não possui	Algo grande (大) e possível (可) que é extraordinário ou ímpar.	N1
忠	Lealdade, fidelidade	チュウ	Não possui	O coração (心) posicionado no meio (中) demonstrando lealdade.	N1
染	Tingir, manchar	セン	そ・める, そ・まる, し・みる, し・み	Água (氵) e madeira (木) usadas nove (九) vezes para tingir.	N1
微	Ligeiro, micro-	ビ, ミ	Não possui	Caminhar (彳) pela montanha (山) em um ligeiro movimento (攵).	N1
標	Sinal, marca	ヒョウ	しるべ	Uma árvore (木) que serve de sinal por ser o voto (票) do caminho.	N1
縁	Afinidade, borda	エン	ふち	Fios (糸) que mostram a afinidade ou borda de um suíno (彖).	N1
壁	Parede, muro	ヘキ	かべ	Terra (土) usada para punir (辟) e formar uma parede.	N1
駆	Dirigir, correr	ク	か・ける, か・る	Um cavalo (馬) correndo em um distrito (区) ao ser dirigido.	N1
麻	Cânhamo	マ	あさ	Sob um abrigo (广), um bosque (林) de cânhamo.	N1
甲	Armadura, primeiro	コウ, カン	Não possui	Um campo (田) com uma linha central (丨) como uma armadura.	N1
藩	Clã, domínio	ハン	Não possui	Grama (艹) no domínio de um clã ou vassalo.	N1
迫	Iminente, urgir	ハク	せま・る	Caminhar (辶) em direção ao branco (白) de forma iminente.	N1
踏	Pisar	トウ	ふ・む, ふ・まえる	O pé (足) que pisa em líquido (沓) ao pisar em algo.	N1
討	Atacar, castigar	トウ	う・つ	Palavras (言) e uma medida (寸) para atacar ou castigar.	N1
聖	Santo, sagrado	セイ, ショウ	ひじり	Um oficial (壬) que usa o ouvido (耳) e a boca (口) para ser santo.	N1
典	Código, cerimônia	テン	Não possui	Colocar a música (曲) sobre a base (八) para seguir um código cerimonial.	N1
剣	Espada	ケン	つるぎ	Uma pessoa que usa a faca (刂) com habilidade (僉) para manejar a espada.	N1
症	Sintoma	ショウ	Não possui	Alguém doente (疒) cujo estado correto (正) de saúde mudou devido a um sintoma.	N1
納	Pagar, liquidar	ノウ, ナッ, ナ, ナン, トウ	おさ・める, おさ・まる	Usar o fio (糸) para trazer para dentro (内) o que se deve pagar ou liquidar.	N1
弥	Crescentemente	ミ, ビ	や	Usar o arco (弓) e ornamentos (尔) que se expandem crescentemente.	N1
融	Dissolver, finanças	ユウ	Não possui	O calor que afeta o recipiente (鬲) e o inseto (虫) ao se dissolver.	N1
浜	Praia	ヒン	はま	A água (氵) onde os soldados (兵) se reúnem na praia.	N1
郷	Terra natal	キョウ, ゴウ	さと	Onde pequenos fios (幺) e o limite (艮) se encontram nos muros (阝) da terra natal.	N1
惑	Enganar, iludir	ワク	まど・う	O coração (心) de alguém (或) que é levado a se enganar ou iludir.	N1
柳	Salgueiro	リュウ	やなぎ	A árvore (木) que cresce perto dos portões (卯) de entrada: o salgueiro.	N1
拠	Base, fundamento	キョ, コ	Não possui	Uma mão (扌) que se apoia em um lugar (処) para ter uma base ou fundamento.	N1
奉	Dedicar, oferecer	ホウ, ブ	たてまつ・る	Mãos (廾) que apresentam uma abundância (丰) grande (大) para dedicar ou oferecer.	N1
壊	Demolir, quebrar	カイ, エ	こわ・す, こわ・れる	Usar a terra (土) e o que está envolto (褱) para demolir ou quebrar.	N1
益	Benefício, lucro	エキ, ヤク	Não possui	O que transborda (丷, 一, 八) de um prato (皿) gerando benefício ou lucro.	N1
句	Frase	ク	Não possui	Palavras envoltas (勹) que saem pela boca (口) formando uma frase.	N1
属	Pertencer, gênero	ゾク	Não possui	O corpo (尸) de um animal (蜀) que indica a qual gênero ou grupo deve pertencer.	N1
功	Mérito, sucesso	コウ, ク	Não possui	O trabalho (工) realizado com muita força (力) que resulta em mérito ou sucesso.	N1
帝	Imperador	テイ, タイ	Não possui	Alguém de pé (立) sob uma cobertura (冖) e um pano (巾) como um imperador.	N1
賀	Parabéns, celebração	ガ	Não possui	Adicionar (加) dinheiro (貝) para celebrar e dar os parabéns.	N1
堀	Fosso, canal	クツ	ほり	A terra (土) que foi forçada a ceder (屈) para criar um fosso ou canal.	N1
創	Criar, ferida	ソウ	つく・る	Usar a faca (刂) no armazém (倉) para criar algo novo ou causar uma ferida.	N1
泣	Chorar	キュウ	な・く	A água (氵) que cai quando alguém fica de pé (立) para chorar.	N1
憶	Memória	オク	Não possui	O coração (忄) que foca em uma ideia (意) para manter a memória.	N1
幹	Tronco (de árvore)	カン	みき	Dez (十) anos cedo (早) na seca (干) fazem a árvore (木) ter um tronco forte.	N1
露	Orvalho, Rússia	ロ, ロウ	つゆ	A chuva (雨) que cai sobre o caminho (路) em forma de orvalho.	N1
矢	Flecha	シ	や	Um ser grande (大) que lança um traço (丿) rápido como uma flecha.	N1
握	Agarrar, aperto	アク	にぎ・る	Uma mão (扌) que se fecha sobre uma casa (屋) ao agarrar com força.	N1
儀	Cerimônia	ギ	Não possui	Uma pessoa (亻) que segue a justiça (義) em uma cerimônia.	N1
聴	Ouvir, escutar	チョウ	き・く	Usar o ouvido (耳) e um coração virtuoso (悳) para ouvir ou escutar.	N1
襲	Atacar	シュウ	おそ・う	O dragão (龍) que se esconde sob a roupa (衣) para atacar.	N1
徴	Sinal, coletar	チョウ, チ	しるし	Caminhar (彳) como um rei (王) na montanha (山) para tomar a ação (攵) de coletar um sinal.	N1
丁	Seção de cidade, contador	チョウ, テイ	Não possui	Desenho de um prego ou ferramenta para marcar uma seção de cidade ou servir de contador.	N1
憲	Constituição	ケン	Não possui	Sob o telhado (宀), proteger contra o dano (害) com os olhos (罒) e o coração (心) da constituição.	N1
閣	Gabinete, prédio alto	カク	Não possui	No portão (門), cada (各) oficial se reúne em um gabinete ou prédio alto.	N1
救	Resgate, salvação	キュウ	すく・う	Tomar a ação (攵) de buscar (求) alguém para o seu resgate ou salvação.	N1
陰	Sombra, escuro	イン	かげ, かげ・る	Um muro (阝) onde agora (今) as nuvens (云) trazem sombra e o escuro.	N1
繰	Enrolar, girar	ク	く・る	Usar o fio (糸) de diversos itens (品) de madeira (木) para enrolar ou girar.	N1
那	Que, aquele	ナ, ダ	Não possui	Uma faca (刀) usada duas (二) vezes nos muros (阝) para indicar que ou aquele lugar.	N1
操	Manipular, operar	ソウ	みさお, あやつ・る	Uma mão (扌) que lida com diversos itens (品) de madeira (木) para manipular ou operar.	N1
騒	Barulho, tumulto	ソウ	さわ・ぐ	Um tumulto causado por um cavalo (馬) e um inseto ou pulga (蚤): muito barulho.	N1
己	Si mesmo, próprio	コ, キ	おのれ	Desenho de um fio ou corda que volta para si mesmo ou para o próprio lugar.	N1
魔	Demônio, magia	マ	Não possui	Sob o cânhamo (麻), o demônio (鬼) pratica a sua magia.	N1
撮	Fotografar	サツ	と・る	Uma mão (扌) que busca o mais (最) importante ao fotografar.	N1
携	Carregar na mão	ケイ	たずさ・える, たずさ・わる	Uma mão (扌) que segura a ave (隹) e a leva adiante (乃) ao carregar na mão.	N1
隣	Vizinho	リン	とな・る, となり	Um muro (阝) onde se troca arroz (米) ao anoitecer (夕) com o vizinho.	N1
宣	Declarar, anunciar	セン	Não possui	Sob o telhado (宀), uma (一) ordem ao amanhecer (旦) para declarar ou anunciar.	N1
遣	Despachar, usar	ケン	つか・う, つか・わす	Percorrer o caminho (辶) no meio (中) de uma (一) tarefa ao despachar alguém.	N1
訴	Processar, reclamar	ソ	うった・える	Palavras (言) que servem para afastar (斥) um erro ao processar ou reclamar.	N1
茂	Crescer denso	モ, ボウ	しげ・る	Grama (艹) que cresce sob a proteção de uma lança (戊) de forma densa.	N1
釣	Pescar	チョウ	つ・る	O uso do metal (金) e de uma colher ou gancho (勺) para pescar.	N1
批	Crítica	ヒ	Não possui	Uma mão (扌) que faz uma comparação (比) ao realizar uma crítica.	N1
誘	Convidar, atrair	ユウ	さそ・う	Usar as palavras (言) com excelência (秀) para convidar ou atrair.	N1
核	Núcleo	カク	Não possui	A madeira (木) que guarda em seu núcleo o signo do porco (亥).	N1
哲	Filosofia, sábio	テツ	Não possui	Uma boca (口) que se dobra (折) em pensamentos profundos para a filosofia.	N1
豪	Luxuoso, grandioso	ゴウ	Não possui	Sob o topo (亠), a cobertura (冖) e a boca (口), o porco (豕) vive de forma luxuosa.	N1
締	Apertar, atar	テイ	し・まる, し・める	Usar o fio (糸) sob o comando do imperador (帝) para apertar ou atar.	N1
鹿	Cervo	ロク	しか, か	Sob o abrigo (广), comparar (比) a beleza da pele do cervo.	N1
就	Assumir cargo, começar	シュウ, ジュ	つ・く, つ・ける	Ir para a capital (京) e se destacar como alguém especial (尤) ao assumir um cargo.	N1
滅	Destruir, ruína	メツ	ほろ・びる, ほろ・ぼす	A água (氵) e o fogo (火) sob a lança (戌) que causam a destruição.	N1
仰	Olhar para cima, reverenciar	ギョウ, コウ	あお・ぐ, おお・せ	Uma pessoa (亻) que se volta para o alto (卬) para reverenciar ou olhar para cima.	N1
瀬	Corredeiras	ライ	せ	A água (氵) que flui com a confiança (頼) das corredeiras.	N1
致	Causar, fazer	チ	いた・す	Chegar ao ápice (至) e tomar uma ação (攵) para causar ou efetivar algo.	N1
伏	Submeter-se, abaixar	フク	ふ・せる, ふ・す	Uma pessoa (亻) agindo como um cachorro (犬) ao se submeter ou abaixar.	N1
杉	Cedro	サン	すぎ	A madeira (木) com ornamentos (彡) longos que formam o cedro.	N1
審	Examinar com cuidado	シン	Não possui	Sob o telhado (宀), observar a ordem (番) das coisas para as examinar com cuidado.	N1
避	Evitar	ヒ	さ・ける	Percorrer o caminho (辶) fugindo da punição (辟) para evitar um problema.	N1
揺	Balançar	ヨウ	ゆ・れる, ゆ・る, ゆ・らぐ, ゆ・るぐ, ゆ・する, ゆ・さぶる, ゆ・すぶる	Uma mão (扌) agitando uma garra (爫) sobre uma lata (缶) ao balançar.	N1
浦	Baía, litoral	ホ	うら	A água (氵) que banha o campo (甫) de uma baía ou litoral.	N1
至	Chegar a, ápice	シ	いた・る	Uma linha (一) privada (厶) sobre a terra (土) para chegar ao ápice.	N1
裕	Abundante, rico	ユウ	Não possui	Roupas (衤) guardadas no vale (谷) indicando que o local é rico ou abundante.	N1
盟	Aliança	メイ	Não possui	Sob o brilho da luz (明), um prato (皿) sela o compromisso de uma aliança.	N1
執	Realizar uma tarefa, tenacidade	シツ, シュウ	と・る	Buscar a felicidade (幸) com tenacidade ao girar em círculo (丸) para realizar uma tarefa.	N1
崩	Desmoronar, colapso	ホウ	くず・れる, くず・す	A montanha (山) e os amigos (朋) que testemunham o desmoronar de uma encosta.	N1
鬼	Demônio, fantasma	キ	おに	Representação visual e estilizada da face de um demônio ou fantasma.	N1
酸	Ácido, azedo	サン	す・い	Um jarro de vinho (酉) deixado ao sol (夋) por muito tempo acaba por ficar ácido.	N1
拡	Expandir	カク	Não possui	Uma mão (扌) que se move em um espaço amplo (広) para expandir.	N1
銃	Arma de fogo	ジュウ	Não possui	O uso do metal (金) para preencher (充) uma arma de fogo.	N1
維	Fibra, manter	イ	Não possui	O fio (糸) que mantém a ave (隹) presa à sua fibra ou manutenção.	N1
縄	Corda	ジョウ	なわ	O fio (糸) trançado com a força de um sapo (黽) para formar uma corda forte.	N1
詩	Poema	シ	Não possui	Palavras (言) proferidas dentro do templo (寺) para criar um poema.	N1
廃	Abolir, descarte	ハイ	すた・れる, すた・る	Sob o abrigo (广), emitir (発) o sinal de abolir ou descartar algo.	N1
充	Alocar, preencher	ジュウ	あ・てる	Alocar (亠, ム) os recursos para a criança (儿) e a preencher de conhecimento.	N1
鏡	Espelho	キョウ, ケイ	かがみ	O metal (金) que reflete o fim (竟) da luz em um espelho.	N1
仮	Temporário, falso	カ, ケ	かり	Uma pessoa (亻) que age de forma oposta (反) por ser algo apenas temporário.	N1
吐	Vomitar, cuspir	ト	は・く	A boca (口) que coloca na terra (土) o que foi expelido ao vomitar.	N1
請	Solicitar, requisitar	セイ, シン	こ・う, う・ける	Palavras (言) ditas sob o céu azul (青) para solicitar ou requisitar algo.	N1
眺	Olhar de longe, vista	チョウ	なが・める	O olho (目) que observa o sinal (兆) ao longe para olhar de longe.	N1
沖	Mar aberto	チュウ	おき	A água (氵) que flui pelo meio (中) de um mar aberto.	N1
躍	Saltar, ser ativo	ヤク	おど・る	Os pés (足) de uma ave (翟) que se movem rapidamente ao saltar.	N1
威	Ameaça, dignidade	イ	Não possui	O signo da lança (戌) e a mulher (女) que impõem dignidade perante uma ameaça.	N1
屈	Ceder, dobrar-se	クツ	Não possui	O corpo (尸) que sai (出) de sua posição original ao ceder ou dobrar-se.	N1
勘	Intuição, considerar	カン	Não possui	Usar a força (力) de forma extrema (甚) seguindo a própria intuição.	N1
徹	Exaustivo, penetrar	テツ	Não possui	Caminhar (彳) para educar (育) e agir (攵) de forma exaustiva ou penetrante.	N1
斎	Purificar, culto	サイ	Não possui	O alinhamento (斉) cerimonial diante de um altar (示) para se purificar.	N1
謝	Desculpas, gratidão	シャ	あやま・る	Palavras (言) que se atiram (射) em direção ao outro ao pedir desculpas ou gratidão.	N1
艦	Navio de guerra	カン	Não possui	Um barco (舟) que supervisiona (監) a batalha como um navio de guerra.	N1
催	Realizar (evento), urgir	サイ	もよお・す	Uma pessoa (亻) na montanha (崔) que precisa realizar um evento com urgência.	N1
舎	Prédio, alojamento	シャ	Não possui	Pessoas (人) que vivem sobre a terra (土) com uma boca (口) para alimentar em um alojamento.	N1
仁	Humanidade, benevolência	ジン, ニ	Não possui	Uma pessoa (亻) agindo por dois (二) com humanidade e benevolência.	N1
衝	Colisão, impulso	ショウ	Não possui	Seguir pelo caminho (行) com um fardo pesado (重) resulta em uma colisão.	N1
脚	Perna, pé	キャク, キャ	あし	Parte do corpo (月) que se usa para rejeitar (却) algo com um chute: a perna.	N1
虎	Tigre	コ	とら	Um animal com a pele listrada (虍) que caminha sobre pernas (儿) fortes: o tigre.	N1
潮	Maré	チョウ	しお	A água (氵) que sobe todas as manhãs (朝) como uma maré.	N1
穴	Buraco, caverna	ケツ	あな	Sob um telhado (宀), as partes (八) que formam um buraco ou caverna.	N1
怪	Mistério, monstro	カイ	あや・しい, あや・しむ	Um sentimento no coração (忄) diante de algo sagrado (圣) ou estranho: um mistério.	N1
仙	Eremita, místico	セン	Não possui	Uma pessoa (亻) que vive na montanha (山) como um eremita.	N1
輝	Brilho, radiante	キ	かがや・く	O brilho (光) de um exército (軍) em marcha é radiante.	N1
緊	Tensão, apertar	キン	Não possui	Um retentor (臣) que usa a mão (又) para apertar os fios (糸) de uma tensão.	N1
唇	Lábio	シン	くちびる	O tempo do dragão (辰) que se expressa pela boca (口) através do lábio.	N1
忍	Suportar, ocultar	ニン, ジン	しの・ぶ, しの・ばせる	Uma lâmina (刃) sobre o coração (心) que se deve suportar ou ocultar.	N1
狂	Louco, enlouquecer	キョウ	くる・う, くる・おしい	Um animal (犭) que se comporta como um rei (王) ao enlouquecer.	N1
奪	Tomar, roubar	ダツ	うば・う	Um ser grande (大) que usa a ave (隹) e a medida (寸) para tomar ou roubar algo.	N1
